{
  "meta": {
    "title": "年份 + 考试名称完整标题",
    "subtitle": "副标题（如有）",
    "subject": "地理",
    "grade": "高三",
    "source_file": "原始文件路径（相对路径即可）",
    "notes": "注意事项：1. 本试卷分第I卷... 2. 答卷前...",
    "notes_items": [
      {
        "type": "title",
        "content": "注意事项"
      },
      {
        "type": "item",
        "number": "1",
        "content": "作答前，考生务必将自己的姓名、准考证号填写在答题卡上。"
      },
      {
        "type": "item",
        "number": "2",
        "content": "回答选择题时，选出每小题答案后，用铅笔把答题卡上对应题目的答案标号涂黑。"
      },
      {
        "type": "item",
        "number": "3",
        "content": "考试结束后，将本试卷和答题卡一并交回。"
      }
    ]
  },

  "document": {
    "sections": [
      {
        "id": "section_001",
        "type": "选择题",
        "title": "一、选择题：本题共XX小题，每小题X分，共XX分。",
        "instructions": [
          "在每小题给出的四个选项中，只有一项是符合题目要求的。"
        ],
        "questions": [
          {
            "id": "question_001",
            "number": "1",
            "question_type": "选择题",
            "stem": "选择题题干内容（不含占位符的纯文本）",
            "options": [
              { "label": "A", "text": "选项A 内容" },
              { "label": "B", "text": "选项B 内容" },
              { "label": "C", "text": "选项C 内容" },
              { "label": "D", "text": "选项D 内容" }
            ],
            "placeholders": []
          },
          {
            "id": "question_002",
            "number": "2",
            "question_type": "选择题",
            "stem": "题干提到「如图X所示」的题目，需要在此插入图片占位符",
            "options": [
              { "label": "A", "text": "选项A" },
              { "label": "B", "text": "选项B" },
              { "label": "C", "text": "选项C" },
              { "label": "D", "text": "选项D" }
            ],
            "placeholders": [
              {
                "placeholder_id": "ph_001",
                "token": "{{image:ph_001}}",
                "location_type": "question_stem",
                "owner_id": "question_002",
                "context_before": "图X为某区域等高线",
                "context_after": "，据此回答2~3题。",
                "reason": "题干明确提到'如图'，需要插入对应图片"
              }
            ]
          }
        ]
      },
      {
        "id": "section_002",
        "type": "非选择题",
        "title": "二、非选择题：共XX分。",
        "instructions": [],
        "questions": [
          {
            "id": "question_003",
            "number": "XX",
            "question_type": "非选择题",
            "stem": "非选择题题干",
            "materials": [
              {
                "id": "material_001",
                "content": "材料：一段较长的阅读材料文本……",
                "guide_sentence": "据此完成下面小题。"
              },
              {
                "id": "material_002",
                "content": "",
                "guide_sentence": "完成下列要求。",
                "segments": [
                  {
                    "type": "text",
                    "content": "下表为某地区2020-2024年人口迁移数据统计表。"
                  },
                  {
                    "type": "table",
                    "data": {
                      "rows": 5,
                      "cols": 4,
                      "data": [
                        ["年份", "迁入人口（万人）", "迁出人口（万人）", "净迁移率（%）"],
                        ["2020", "12.5", "8.3", "+4.2"],
                        ["2021", "15.2", "9.1", "+6.1"],
                        ["2022", "18.6", "10.5", "+8.1"],
                        ["2023", "22.3", "12.8", "+9.5"]
                      ]
                    }
                  },
                  {
                    "type": "image",
                    "name": "img_003.png"
                  },
                  {
                    "type": "text",
                    "content": "（注：表中数据为年末统计值）"
                  }
                ]
              }
            ],
            "subquestions": [
              {
                "id": "subq_001",
                "label": "(1)",
                "stem": "第一小问题干"
              },
              {
                "id": "subq_002",
                "label": "(2)",
                "stem": "第二小问题干"
              },
              {
                "id": "subq_003",
                "label": "(3)",
                "stem": "第三小问题干（含占位符示例）"
              },
              {
                "id": "subq_004",
                "label": "①",
                "stem": "马山县所在省区与粤港澳地区毗邻，运输距离短，运输成本低"
              },
              {
                "id": "subq_005",
                "label": "②",
                "stem": "马山县发展较为滞后，当地黑山羊销售价格与粤港澳地区差异大，将黑山羊销往粤港澳地区______"
              },
              {
                "id": "subq_006",
                "label": "③",
                "stem": "粤港澳地区人口众多______，______"
              }
            ],
            "placeholders": [
              {
                "placeholder_id": "ph_002",
                "token": "{{image:ph_002}}",
                "location_type": "material",
                "owner_id": "material_001",
                "context_before": "材料中提到'如图'",
                "context_after": "",
                "reason": "材料中提到'如图XX所示'，需要插入对应的示意图"
              }
            ]
          }
        ]
      }
    ],
    "unclassified_blocks": []
  },

  "images": [
    {
      "image_id": "img_001",
      "file_name": "image1.png",
      "type": "等高线图",
      "summary": "某区域等高线地形图，包含山峰、河流、村镇等要素",
      "keywords": ["等高线", "地形图", "山峰", "河流"],
      "ocr_text": ["图例", "比例尺 1:50000"],
      "discipline_features": ["等值线判读", "地形分析"],
      "clues": ["可能与等高线计算有关", "图中标注了XYZ三个点"],
      "uncertain": false
    },
    {
      "image_id": "img_002",
      "file_name": "image2.png",
      "type": "示意图",
      "summary": "某地理过程示意图",
      "keywords": ["示意图", "过程"],
      "ocr_text": [],
      "discipline_features": [],
      "clues": [],
      "uncertain": false
    }
  ],

  "image_mapping": [
    {
      "placeholder_id": "ph_001",
      "image_id": "img_001",
      "confidence": 0.95,
      "reason": "占位符位于等高线题目题干，与 image2.png 的等高线内容匹配"
    },
    {
      "placeholder_id": "ph_002",
      "image_id": "img_002",
      "confidence": 0.85,
      "reason": "材料中提到示意图，与 image2.png 的描述匹配"
    }
  ],

  "validation": {
    "has_unmapped_placeholders": false,
    "has_unused_images": false,
    "unmapped_placeholders": [],
    "unused_images": [],
    "warnings": []
  }
}
